{
  "engine": "fixture",
  "model": "fixture-v1",
  "version": "1.0.0",
  "settings": {"decoder": "greedy", "sample_rate_hz": "16000"},
  "text": "Patchthrough ships clearly.",
  "language": "en",
  "audio_duration_ms": 1800,
  "processing_duration_ms": 75,
  "words": [
    {"text": "Patchthrough", "start_ms": 100, "end_ms": 700, "confidence": 0.96},
    {"text": "ships", "start_ms": 730, "end_ms": 1100, "confidence": 0.93},
    {"text": "clearly.", "start_ms": 1140, "end_ms": 1700, "confidence": 0.91}
  ],
  "segments": [
    {
      "start_ms": 100,
      "end_ms": 1700,
      "text": "Patchthrough ships clearly.",
      "confidence": 0.933333,
      "words": [
        {"text": "Patchthrough", "start_ms": 100, "end_ms": 700, "confidence": 0.96},
        {"text": "ships", "start_ms": 730, "end_ms": 1100, "confidence": 0.93},
        {"text": "clearly.", "start_ms": 1140, "end_ms": 1700, "confidence": 0.91}
      ]
    }
  ],
  "diagnostics": {"runtime": "fixture", "no_speech_probability": "0.01"},
  "context": {
    "requested_terms": ["Patchthrough"],
    "detected_terms": ["Patchthrough"],
    "applied_terms": ["Patchthrough"]
  }
}
